title,description,published date,url,publisher,content,image,publish_date,default_sentiment,entities,summaries
Former Funeral Home Gets New Life as Senior Housing - Multi-Housing News,Former Funeral Home Gets New Life as Senior Housing  Multi-Housing News,"Wed, 06 Sep 2023 07:00:00 GMT",https://news.google.com/rss/articles/CBMiVWh0dHBzOi8vd3d3Lm11bHRpaG91c2luZ25ld3MuY29tL2Zvcm1lci1mdW5lcmFsLWhvbWUtZ2V0cy1uZXctbGlmZS1hcy1zZW5pb3ItaG91c2luZy_SAQA?oc=5&hl=en-US&gl=US&ceid=US:en,Multi-Housing News,"WPH Holdings has added to Los Angeles’ under-supplied senior housing stock with the opening of Washington View Apartments. The community was developed in partnership with the California-based affordable housing nonprofit Las Palmas Housing. Bank of Hope provided a $33 million loan for the project’s construction, with the Los Angeles city government lending another $12 million, according to Yardi Matrix data. Federal Home Loan Bank of San Francisco provided a $1 million grant. The property was formerly home to the Pierce Brothers Chapel, the first full-service funeral home built in Los Angeles, and an adjoining parking lot and warehouse. The property, which had suffered two fires, was extensively damaged, but WPH Holding’s adaptive reuse process saved and rehabilitated the front of the building, its arcade and the double-height, large chapel. The project also called for rebuilding the historic bell tower and red tile roof, while the stained glass windows were repaired, restored or reconstructed. Located at 720 W. Washington Blvd., Washington View Apartments offers seniors 122 studio and one- and two-bedroom units. The developer also designated 91 of the units for formerly homeless residents. The community includes space for support services, three recreation rooms and open community space. Residents will have access to case management and adult education classes, as well as other resources. Responding to LA’s affordable housing demand Washington View Apartments bolsters WPH Holdings’ portfolio, which mostly includes affordable housing projects in California. Elsewhere in Los Angeles, WPH Holdings is working on a mixed-income, 79-unit project that will offer 12,000 square feet of ground-floor retail. Outside Los Angeles, the developer is developing a pair of Sun Valley, Calif.-based projects. One of those communities is a mixed-use affordable property, while the other is an affordable senior housing community.",https://www.multihousingnews.com/wp-content/uploads/sites/57/2023/09/Mike-Jones-Photographer-Building-2.jpg,2023-09-06,0.059,"[{'type': 'LOC', 'name': 'Los Angeles', 'latitude': 34.05223083496094, 'longitude': -118.24368286132812, 'location_type': 'CITY'}, {'type': 'LOC', 'name': 'Washington', 'latitude': 47.500118255615234, 'longitude': -120.50147247314453, 'location_type': 'UNIT'}, {'type': 'LOC', 'name': 'California', 'latitude': 37.250221252441406, 'longitude': -119.75125885009766, 'location_type': 'UNIT'}, {'type': 'LOC', 'name': 'Las Palmas', 'latitude': 28.099729537963867, 'longitude': -15.413430213928223, 'location_type': 'CITY'}, {'type': 'LOC', 'name': 'Bank', 'latitude': 42.75035858154297, 'longitude': -71.83702087402344, 'location_type': 'CITY'}, {'type': 'LOC', 'name': 'Yardi', 'latitude': 12.401200294494629, 'longitude': 42.89686965942383, 'location_type': 'LANDMARK'}, {'type': 'LOC', 'name': 'San Francisco', 'latitude': 37.77492904663086, 'longitude': -122.41941833496094, 'location_type': 'CITY'}, {'type': 'LOC', 'name': 'Pierce', 'latitude': 37.1863899230957, 'longitude': -85.60778045654297, 'location_type': 'CITY'}, {'type': 'LOC', 'name': 'Chapel', 'latitude': 33.956668853759766, 'longitude': -83.37515258789062, 'location_type': 'POI'}, {'type': 'LOC', 'name': 'Sun Valley', 'latitude': 34.217498779296875, 'longitude': -118.370361328125, 'location_type': 'CITY'}]",Not-related content.
"Affordable Seniors Housing Comes to Perris, Calif. - Apartment Finance Today","Affordable Seniors Housing Comes to Perris, Calif.  Apartment Finance Today","Wed, 21 Feb 2024 08:00:00 GMT",https://news.google.com/rss/articles/CBMiXmh0dHBzOi8vd3d3LmhvdXNpbmdmaW5hbmNlLmNvbS9kZXZlbG9wbWVudHMvYWZmb3JkYWJsZS1zZW5pb3JzLWhvdXNpbmctY29tZXMtdG8tcGVycmlzLWNhbGlmX2_SAQA?oc=5&hl=en-US&gl=US&ceid=US:en,"{'href': 'https://www.housingfinance.com', 'title': 'Apartment Finance Today'}",,,,,,Not-related content.
Change Lending keeps CDFI certification after agreement with US Treasury - HousingWire,Change Lending keeps CDFI certification after agreement with US Treasury  HousingWire,"Fri, 03 Nov 2023 07:00:00 GMT",https://news.google.com/rss/articles/CBMibmh0dHBzOi8vd3d3LmhvdXNpbmd3aXJlLmNvbS9hcnRpY2xlcy9jaGFuZ2UtbGVuZGluZy1rZWVwcy1jZGZpLWNlcnRpZmljYXRpb24tYWZ0ZXItYWdyZWVtZW50LXdpdGgtdXMtdHJlYXN1cnkv0gEA?oc=5&hl=en-US&gl=US&ceid=US:en,HousingWire,"Non-bank originator Change Lending will continue to originate non-qualified mortgages (non-QMs) for underserved borrowers after it reached a tentative deal with the U.S. Department of Treasury that would keep the firm certified as a Community Development Financial Institution (CDFI). The CDFI certification is a designation given by the Treasury Department CDFI Fund to specialized organizations that provide financial services to low-income communities and people who lack financing. At least 60% of a lender’s financing must target low- and moderate-income borrowers or customers in underserved communities. In a new agreement, the CDFI Fund has withdrawn its decertification of Change Lending from the CDFI Fund and, in exchange, the lender will drop its lawsuit against the Treasury Department, according to a letter sent to Change’s attorneys from the Department of Justice on Oct. 31. Change is now in good standing with the CDFI Fund and its next planned certification review is not until 2025, the originator said. “We are pleased to have resolved any misunderstandings with the CDFI Fund and appreciate the CDFI Fund’s collaborative approach and willingness to agree to this settlement in principle. We believe that today’s agreement will benefit all stakeholders. Change is proud to be certified as a CDFI and to continue our mission,” Carlos Salas, CEO of Change Lending, said in a statement. The agreement puts an end to a short-lived legal dispute with the Treasury Department. Change Lending was removed from the CDFI Fund’s list of certified program lenders in August after a Barron‘s investigation found that the lender failed to meet its underserved lending requirements in 2022. Change sued the CDFI Fund in late August claiming the Fund’s “flawed analysis and mathematical errors” led to the decertification decision. A federal judge sided with Change in September, allowing the originator to continue its mortgage offerings for underserved borrowers until at least December. Since becoming a CDFI in 2018, Change has funded more than $25 billion in loans to more than 75,000 families, according to the lender. In October, the company sued Adam Levine, CEO Steven Sugarman’s former chief of staff, after the former high-ranking employee accused the firm of retaliation when he notified executives of employees “mischaracterizing loans” to skirt federal reporting requirements. Levine was fired in March over multiple accusations of workplace misconduct. Change accused Levine of committing fraud and breaching his contract with the firm to advance his scheme to extort Change and its principals for over $10 million. In 2015, Levine’s former employer, TPG Global, also sued him for taking confidential documents and distributing them to media outlets after being denied a promotion. A federal judge that year ordered Levine to return TPG’s confidential information back to the company.",https://www.housingwire.com/wp-content/uploads/2020/09/Home-Swap-e1693823637759.jpeg,2023-11-03,-0.436,"[{'type': 'LOC', 'name': 'Change', 'latitude': 27.348939895629883, 'longitude': 87.60993194580078, 'location_type': 'CITY'}, {'type': 'LOC', 'name': 'Department of Justice', 'latitude': 14.579360008239746, 'longitude': 120.98387145996094, 'location_type': 'POI'}, {'type': 'LOC', 'name': 'Carlos Salas', 'latitude': -35.393028259277344, 'longitude': -61.99747848510742, 'location_type': 'CITY'}, {'type': 'LOC', 'name': 'Barron', 'latitude': 42.846168518066406, 'longitude': -2.992579936981201, 'location_type': 'CITY'}, {'type': 'LOC', 'name': 'Levine', 'latitude': 50.002811431884766, 'longitude': -100.13278198242188, 'location_type': 'CITY'}]",Not-related content.
"Eden Housing Opens The Randall in Healdsburg, Sonoma County - San Francisco YIMBY","Eden Housing Opens The Randall in Healdsburg, Sonoma County  San Francisco YIMBY","Sat, 16 Sep 2023 07:00:00 GMT",https://news.google.com/rss/articles/CBMiW2h0dHBzOi8vc2Z5aW1ieS5jb20vMjAyMy8wOS9lZGVuLWhvdXNpbmctb3BlbnMtdGhlLXJhbmRhbGwtaW4taGVhbGRzYnVyZy1zb25vbWEtY291bnR5Lmh0bWzSAQA?oc=5&hl=en-US&gl=US&ceid=US:en,San Francisco YIMBY,"City officials and the development team gathered yesterday afternoon to celebrate the opening of Randall, a new affordable apartment complex in Healdsburg, Sonoma County. The development has replaced a former wood mill with 41 affordable homes. Eden Housing partnered with Replay Resorts to head development. Eden will serve as property management for future residents. Of the 41 units, there will be eight units priced for extremely low-income households, 32 for very low-income households, and one moderate-income apartment for the on-site manager. The extremely-low housing will be reserved for project-based voucher referrals from the Sonoma County Housing Authority. The 32 low-income apartments will be chosen from the Eden lottery application waitlist. Rents for those apartments are expected to start in the low $1,100’s per month for a one-bedroom, under $1,350 for a two-bedroom, and under $1,550 for a three-bedroom. Apartment sizes will vary with 19 one-bedrooms, 11 two-bedrooms, and 11 three-bedrooms. Parking will be included for 41 cars. Bicycle parking is included, but the capacity is not specified. Residents will be offered a variety of amenities inside the building, including a community room, lounge, an open kitchen, a community garden, and an open-air courtyard. The open space will even include barbeque grills and a children’s playground for families. PYATOK Architecture + Design is responsible for the design. The four-story structure conforms to the narrow, long parcel with awnings above each window to regulate interior comfort. Vertical louver panels create a striking focal point over the outdoor landscaped plaza. The 0.86-acre parcel is located by Downtown Healdsburg, close to the Russian River and Foss Creek Pathway. Healdsburg is a northern Sonoma County city north of Santa Rosa and south of Geyserville. Funding was provided by the city, County of Sonoma, the Sonoma County Housing Authority, Replay, Wells Fargo, California Community Reinvestment Corporation, Federal Home Loan Bank of San Francisco and California Tax Credit Allocation Committee. West Creek Builders was the general contractor responsible for building the apartments. Subscribe to YIMBY’s daily e-mail Follow YIMBYgram for real-time photo updates Like YIMBY on Facebook Follow YIMBY’s Twitter for the latest in YIMBYnews",https://sfyimby.com/wp-content/uploads/2023/09/The-Randall-rendering-by-PYATOK.jpg,2023-09-18,-0.093,"[{'type': 'ORG', 'name': 'Twitter', 'description': 'American social networking site', 'full_name': 'Twitter', 'image': 'https://upload.wikimedia.org/wikipedia/commons/4/47/Capturadeteledacontadawikipedianotwitter.png'}, {'type': 'LOC', 'name': 'Randall', 'latitude': 45.695831298828125, 'longitude': -92.83528137207031, 'location_type': 'CITY'}, {'type': 'LOC', 'name': 'Healdsburg', 'latitude': 38.610469818115234, 'longitude': -122.8691635131836, 'location_type': 'CITY'}, {'type': 'LOC', 'name': 'Sonoma County', 'latitude': 38.54999923706055, 'longitude': -122.90110778808594, 'location_type': 'UNIT'}, {'type': 'LOC', 'name': 'Eden', 'latitude': -28.944650650024414, 'longitude': 29.796649932861328, 'location_type': 'POI'}, {'type': 'LOC', 'name': 'Russian River', 'latitude': 38.450469970703125, 'longitude': -123.12944793701172, 'location_type': 'LANDMARK'}, {'type': 'LOC', 'name': 'Foss Creek', 'latitude': 38.603240966796875, 'longitude': -122.86888122558594, 'location_type': 'LANDMARK'}, {'type': 'LOC', 'name': 'Santa Rosa', 'latitude': 38.44047164916992, 'longitude': -122.71443176269531, 'location_type': 'CITY'}, {'type': 'LOC', 'name': 'Geyserville', 'latitude': 38.70769119262695, 'longitude': -122.90249633789062, 'location_type': 'CITY'}, {'type': 'LOC', 'name': 'County', 'latitude': 52.02949905395508, 'longitude': 1.0807000398635864, 'location_type': 'POI'}, {'type': 'LOC', 'name': 'Sonoma', 'latitude': 38.2918586730957, 'longitude': -122.45803833007812, 'location_type': 'CITY'}, {'type': 'LOC', 'name': 'California', 'latitude': 37.250221252441406, 'longitude': -119.75125885009766, 'location_type': 'UNIT'}, {'type': 'LOC', 'name': 'Bank', 'latitude': 50.82939910888672, 'longitude': 6.0697197914123535, 'location_type': 'CITY'}, {'type': 'LOC', 'name': 'San Francisco', 'latitude': 37.77492904663086, 'longitude': -122.41941833496094, 'location_type': 'CITY'}, {'type': 'LOC', 'name': 'Committee', 'latitude': -33.15781021118164, 'longitude': 26.832590103149414, 'location_type': 'CITY'}, {'type': 'LOC', 'name': 'West Creek', 'latitude': -25.566669464111328, 'longitude': 144.81666564941406, 'location_type': 'LANDMARK'}]",Not-related content.
Jonathan Kim joins News Finance at The New York Times - Editor And Publisher Magazine,Jonathan Kim joins News Finance at The New York Times  Editor And Publisher Magazine,"Fri, 03 Nov 2023 07:00:00 GMT",https://news.google.com/rss/articles/CBMiZ2h0dHBzOi8vd3d3LmVkaXRvcmFuZHB1Ymxpc2hlci5jb20vc3Rvcmllcy9qb25hdGhhbi1raW0tam9pbnMtbmV3cy1maW5hbmNlLWF0LXRoZS1uZXcteW9yay10aW1lcywyNDY1NDbSAQA?oc=5&hl=en-US&gl=US&ceid=US:en,"{'href': 'https://www.editorandpublisher.com', 'title': 'Editor And Publisher Magazine'}",,,,,,Not-related content.
Leader's of Influence: Banking - Simone Lagomarsino - Los Angeles Business Journal,Leader's of Influence: Banking - Simone Lagomarsino  Los Angeles Business Journal,"Tue, 01 Aug 2023 07:00:00 GMT",https://news.google.com/rss/articles/CBMiXWh0dHBzOi8vbGFidXNpbmVzc2pvdXJuYWwuY29tL2N1c3RvbS1jb250ZW50L2xlYWRlcnMtb2YtaW5mbHVlbmNlLWJhbmtpbmctc2ltb25lLWxhZ29tYXJzaW5vL9IBAA?oc=5&hl=en-US&gl=US&ceid=US:en,Los Angeles Business Journal,"SIMONE LAGOMARSINO President & Chief Executive Luther Burbank Corp. Simone Lagomarsino, who has served as Luther Burbank’s president and chief executive since 2019, has taken on a number of new roles. Lagomarsino also leads Luther Burbank’s executive committee. In addition to her role at the company, Lagomarsino has served as chair of the Board of Directors of the Federal Home Loan Bank of San Francisco since 2022 and as a director since 2013. She has served on the board of directors of the Federal Reserve Bank of San Francisco since 2022 and was re-elected in 2022 to a three-year term. She served as a director of Hannon Armstrong Sustainable Infrastructure Capital, Inc. from 2019 to 2022. Prior to joining Luther Burbank, Lagomarsino served as president and CEO of the Western Bankers Association and as a director of Pacific Premier Bancorp. She previously held executive positions at financial institutions including City National Bank and Hawthorne Savings.",https://labusinessjournal.com/wp-content/uploads/2023/08/Lagomarsino_Simone_LutherBurbankCorp_SMALL.png,2023-08-01,0.281,"[{'type': 'LOC', 'name': 'Bank', 'latitude': 50.82939910888672, 'longitude': 6.0697197914123535, 'location_type': 'CITY'}, {'type': 'LOC', 'name': 'San Francisco', 'latitude': 37.77492904663086, 'longitude': -122.41941833496094, 'location_type': 'CITY'}, {'type': 'LOC', 'name': 'Western', 'latitude': 0.5, 'longitude': 34.58332824707031, 'location_type': 'UNIT'}, {'type': 'LOC', 'name': 'City National Bank', 'latitude': 29.30500030517578, 'longitude': -94.79332733154297, 'location_type': 'POI'}, {'type': 'LOC', 'name': 'Hawthorne', 'latitude': 45.006500244140625, 'longitude': -93.28710174560547, 'location_type': 'CITY'}]","Simone Lagomarsino, President & CEO of Luther Burbank Corp., has served as Chair of the Board of Directors of the Federal Home Loan Bank of San Francisco since 2022 and as a director since 2013."
Guardian Village project in Reedley benefits from affordable housing grant - The Business Journal,Guardian Village project in Reedley benefits from affordable housing grant  The Business Journal,"Thu, 05 Oct 2023 07:00:00 GMT",https://news.google.com/rss/articles/CBMiamh0dHBzOi8vdGhlYnVzaW5lc3Nqb3VybmFsLmNvbS9ndWFyZGlhbi12aWxsYWdlLXByb2plY3QtaW4tcmVlZGxleS1iZW5lZml0cy1mcm9tLWFmZm9yZGFibGUtaG91c2luZy1ncmFudC_SAQA?oc=5&hl=en-US&gl=US&ceid=US:en,"{'href': 'https://thebusinessjournal.com', 'title': 'The Business Journal'}",,,,,,Not-related content.
