title,description,published date,url,publisher,content,image,publish_date,default_sentiment,entities,summaries
Change Lending to join Federal Home Loan Bank of San Francisco - HousingWire,Change Lending to join Federal Home Loan Bank of San Francisco  HousingWire,"Thu, 14 Mar 2024 07:00:00 GMT",https://news.google.com/rss/articles/CBMiZGh0dHBzOi8vd3d3LmhvdXNpbmd3aXJlLmNvbS9hcnRpY2xlcy9jaGFuZ2UtbGVuZGluZy10by1qb2luLWZlZGVyYWwtaG9tZS1sb2FuLWJhbmstb2Ytc2FuLWZyYW5jaXNjby_SAQA?oc=5&hl=en-US&gl=US&ceid=US:en,HousingWire,"Nonbank mortgage originator Change Lending will become a member of the Federal Home Loan Bank of San Francisco (FHLB-SF). The Anaheim, California-based originator’s application was approved on Wednesday after it fulfilled all statutory requirements for membership, including those related to capital, profitability and liquidity, the company reported. Change’s membership will become effective upon its acquisition of the required $7 million capital stock in the FHLB-SF. The transaction is expected to close in May. “We welcome a partnership with the FHLB-SF to enhance our strength and reach as America’s CDFI,” said Steven Sugarman, founder of the Change Company, the parent company of Change Lending. “We are excited to expand our impact and better serve our target market borrowers.” Change is a community development financial institution (CDFI) that is certified by the U.S. Treasury Department, given to specialized organizations that provide financial services to low-income communities and others who lack financing options. Change and the Treasury Department went through a short-lived legal dispute after the lender sued the CDFI Fund for its “flawed analysis and mathematical errors,” leading to a decertification of Change Lending. The Treasury Department renewed the certification in February following a settlement agreement in November 2023. Change Lending’s services include small-business loans and lines of credit, investor real estate loans, rehab loans and renovation loans, according to its website. Since becoming a CDFI in 2018, Change has funded more than $25 billion in loans to more than 75,000 borrowers, the lender reported. Last year, Change Lending ranked as the top nonqualified mortgage (non-QM) originator, posting $4.1 billion in 2022 production volume, per Scotsman Guide.",https://www.housingwire.com/wp-content/uploads/2020/06/FHLBanks.jpeg,2024-03-14,0.181,"[{'type': 'LOC', 'name': 'Bank', 'latitude': 50.82939910888672, 'longitude': 6.0697197914123535, 'location_type': 'CITY'}, {'type': 'LOC', 'name': 'San Francisco', 'latitude': 37.77492904663086, 'longitude': -122.41941833496094, 'location_type': 'CITY'}, {'type': 'LOC', 'name': 'Anaheim', 'latitude': 33.835289001464844, 'longitude': -117.91449737548828, 'location_type': 'CITY'}, {'type': 'LOC', 'name': 'California', 'latitude': 37.250221252441406, 'longitude': -119.75125885009766, 'location_type': 'UNIT'}, {'type': 'LOC', 'name': 'America', 'latitude': 39.7599983215332, 'longitude': -98.5, 'location_type': 'COUNTRY'}, {'type': 'LOC', 'name': 'Change', 'latitude': 32.14590072631836, 'longitude': 74.52554321289062, 'location_type': 'CITY'}, {'type': 'LOC', 'name': 'Scotsman', 'latitude': -25.628049850463867, 'longitude': 31.419260025024414, 'location_type': 'POI'}]","Change Lending, a nonbank mortgage originator, will join the Federal Home Loan Bank of San Francisco (FHLB-SF) after meeting membership requirements. The membership will enhance Change's strength and reach as a CDFI, allowing it to better serve low-income communities."
Change Lending Approved For Membership In Federal Home Loan Bank Of San Francisco - National Mortgage Professional,Change Lending Approved For Membership In Federal Home Loan Bank Of San Francisco  National Mortgage Professional,"Wed, 13 Mar 2024 07:00:00 GMT",https://news.google.com/rss/articles/CBMidWh0dHBzOi8vbmF0aW9uYWxtb3J0Z2FnZXByb2Zlc3Npb25hbC5jb20vbmV3cy9jaGFuZ2UtbGVuZGluZy1hcHByb3ZlZC1tZW1iZXJzaGlwLWZlZGVyYWwtaG9tZS1sb2FuLWJhbmstc2FuLWZyYW5jaXNjb9IBAA?oc=5&hl=en-US&gl=US&ceid=US:en,National Mortgage Professional,"Non-QM Change Lending Approved For Membership In Federal Home Loan Bank Of San Francisco Mar 13, 2024 Image By Christine Stuart News Director Change Lending, a CDFI, obtains membership approval from FHLB-SF after meeting all statutory requirements. Change Lending, LLC, a community development financial institution (CDFI), announced that the Federal Home Loan Bank of San Francisco (FHLB-SF) has approved its application for membership. The non-bank lender has 60 days to fund the required capital stock purchase, which will be around $7 million, and expects the transaction to close in May. The decision comes after Change met all statutory requirements, including capital, profitability, and liquidity standards. ""Change Lending is proud to become a member of the FHLB-SF,"" founder of the Change Company Steven Sugarman said. ""We welcome a partnership with the FHLB-SF to enhance our strength and reach as America’s CDFI. We are excited to expand our impact and better serve our target market borrowers."" Change Lending, along with its parent, The Change Company, hold certification from the U.S. Department of the Treasury as CDFIs. That status was threatened in 2023. Since then the U.S. Department of the Treasury's Community Development Financial Institutions Fund renewed Change's CDFI Certification in February 2024. Get the NMP Daily Essential stories, every weekday. Change says it has focused on providing home loans to underserved, prime homeowners, with a significant emphasis on supporting Black, Latino, and low-income borrowers, as well as those residing in low-income communities. ""We are pleased with the decision of the FHFA and FHLB-SF to approve Change’s application for membership in the FHLB-SF. We look forward to working in partnership with the FHLB-SF to bring greater equity to homeownership,"" stated Rev. Everett Bell, Jr., chair of Change's Community Advisory Board. Change's approval for FHLB-SF membership highlights its position as America’s largest Non-QM lender and the first non-bank CDFI to achieve a AAA-rating on its residential mortgage loan securitizations. Change Lending Non-QM Change About the author Image Christine Stuart News Director Christine Stuart is the news director at NMP. Link copied Published Mar 13, 2024 Coming Up See All Apr 03 Coastal Connect Mortgage Expo Jacksonville, FL Apr 23 OriginatorTech Deep Dive: CreditXpert Webinar 2 PM ET May 02 California Mortgage Expo — Irvine Irvine, CA Get the NMP Daily Advertisement Advertisement Courts Borrowers File Class Action Lawsuit Against UWM Plaintiffs claim that UWM cheated hundreds of thousands of borrowers out of billions of dollars. Borrowers filed a class action lawsuit against United Wholesale Mortgage (UWM) and CEO Mat Ishbia, alleging the lender violated the RICO Act and the Real Estate Settlement Procedures Act (RESPA), civil conspiracy and unjust enrichment among other claims. The lawsuit was ... Continue reading Advertisement Analysis and Data Mortgage Applications Decrease 0.6% From Week Prior Elevated mortgage rates weigh down on home buying, according to MBA economists. Mortgage applications decreased 0.6 % for the week ending March 29 from one week earlier, according to data from the Mortgage Bankers Association’s (MBA) Weekly Mortgage Applications Survey. The Market Composite Index, which measures mortgage loan application volume, dec... Continue reading Renew your NMLS License — for free. Enjoy access to a free NMLS renewal class when you attend an in-person event. Find an event Jun 04 Motor City Mortgage Expo Detroit, MI These stories, your inbox. Subscribe to the NMP Daily newsletter. More from Non-QM Change Lending Approved For Membership In Federal Home Loan Bank Of San Francisco Change Lending, a CDFI, obtains membership approval from FHLB-SF after meeting all statutory requirements. Non-QM Mar 13, 2024 Verus Mortgage Capital Leads Non-Agency MBS Issuance In 2023 Specialist in Non-QM and investor rental programs emerges as dominant player. Non-QM Mar 12, 2024 Angel Oak Mortgage REIT, Inc. Weathered Financial Headwinds In 2023 Despite missing non-GAAP EPS forecasts, Angel Oak grows loan portfolio, enhances liquidity, and optimizes operations. Non-QM Mar 06, 2024 dv01 Analysis Reveals Shift In Non-QM Loan Modifications Despite decrease in loan modifications, more borrowers opt for permanent payment reductions. Non-QM Mar 06, 2024 dv01 and Fitch Ratings Collaborate On Non-Agency RMBS Benchmarks Strategic collaboration between dv01 and Fitch Ratings introduces benchmarks aiming to enhance transparency and redefine market analysis in Non-QM and Prime Jumbo markets. Non-QM Feb 21, 2024 LendSure Mortgage Corp. Unveils BOOST A bridge loan program for brokers and homebuyers. Non-QM Feb 21, 2024 Popular Honey, I Shrunk The House Analysis and Data Apr 03, 2024 LYNK Capital Promotes Dee Toal-Brothers To CEO Position People On The Move Apr 03, 2024 Floify President and GM Advising Broker Action Coalition Tech Apr 03, 2024 Kentucky Legislature Passes Bill Banning NTRAPS Regulation and Compliance Apr 03, 2024",https://nationalmortgageprofessional.com/sites/default/files/2023-06/Change_Lending_Logo.png,2024-03-13,0.198,"[{'type': 'LOC', 'name': 'Bank', 'latitude': 50.82939910888672, 'longitude': 6.0697197914123535, 'location_type': 'CITY'}, {'type': 'LOC', 'name': 'LLC', 'latitude': 52.92100143432617, 'longitude': -4.057000160217285, 'location_type': 'POI'}, {'type': 'LOC', 'name': 'San Francisco', 'latitude': 37.77492904663086, 'longitude': -122.41941833496094, 'location_type': 'CITY'}, {'type': 'LOC', 'name': 'Change', 'latitude': 32.14590072631836, 'longitude': 74.52554321289062, 'location_type': 'CITY'}, {'type': 'LOC', 'name': 'America', 'latitude': 39.7599983215332, 'longitude': -98.5, 'location_type': 'COUNTRY'}, {'type': 'LOC', 'name': 'NMP', 'latitude': 52.23830032348633, 'longitude': -0.9071000218391418, 'location_type': 'POI'}, {'type': 'LOC', 'name': 'Black', 'latitude': 37.53144073486328, 'longitude': -90.93318176269531, 'location_type': 'CITY'}, {'type': 'LOC', 'name': 'California', 'latitude': 37.250221252441406, 'longitude': -119.75125885009766, 'location_type': 'UNIT'}, {'type': 'LOC', 'name': 'Expo', 'latitude': 50.107601165771484, 'longitude': 14.434200286865234, 'location_type': 'POI'}, {'type': 'LOC', 'name': 'United', 'latitude': 40.21839904785156, 'longitude': -79.48782348632812, 'location_type': 'CITY'}, {'type': 'LOC', 'name': 'Act', 'latitude': -35.5, 'longitude': 149.0, 'location_type': 'UNIT'}, {'type': 'LOC', 'name': 'MBA', 'latitude': -1.6971800327301025, 'longitude': 37.618080139160156, 'location_type': 'LANDMARK'}, {'type': 'LOC', 'name': 'Agency', 'latitude': 40.99502182006836, 'longitude': -92.30684661865234, 'location_type': 'CITY'}, {'type': 'LOC', 'name': 'Angel', 'latitude': 47.283390045166016, 'longitude': 8.865519523620605, 'location_type': 'POI'}, {'type': 'LOC', 'name': 'REIT', 'latitude': 48.16682052612305, 'longitude': 12.020119667053223, 'location_type': 'POI'}, {'type': 'LOC', 'name': 'GAAP', 'latitude': -28.2951602935791, 'longitude': 24.205049514770508, 'location_type': 'POI'}, {'type': 'LOC', 'name': 'EPS', 'latitude': 51.33399963378906, 'longitude': -0.26899999380111694, 'location_type': 'POI'}, {'type': 'LOC', 'name': 'Fitch', 'latitude': 41.696441650390625, 'longitude': -83.59076690673828, 'location_type': 'CITY'}, {'type': 'LOC', 'name': 'House', 'latitude': 34.646728515625, 'longitude': -103.90441131591797, 'location_type': 'CITY'}, {'type': 'LOC', 'name': 'Kentucky', 'latitude': 38.20042037963867, 'longitude': -84.87761688232422, 'location_type': 'UNIT'}]","Change Lending, a CDFI, has been approved for membership in the Federal Home Loan Bank of San Francisco (FHLB-SF) after meeting all statutory requirements. The non-bank lender will fund the required capital stock purchase of around $7 million within 60 days, and the transaction is expected to close in May."
Change Lending Approved for Membership in the Federal Home Loan Bank of San Francisco - FinTech Futures,Change Lending Approved for Membership in the Federal Home Loan Bank of San Francisco  FinTech Futures,"Wed, 13 Mar 2024 07:00:00 GMT",https://news.google.com/rss/articles/CBMifmh0dHBzOi8vd3d3LmZpbnRlY2hmdXR1cmVzLmNvbS90ZWNod2lyZS9jaGFuZ2UtbGVuZGluZy1hcHByb3ZlZC1mb3ItbWVtYmVyc2hpcC1pbi10aGUtZmVkZXJhbC1ob21lLWxvYW4tYmFuay1vZi1zYW4tZnJhbmNpc2NvL9IBAA?oc=5&hl=en-US&gl=US&ceid=US:en,FinTech Futures,"ANAHEIM, Calif.–(BUSINESS WIRE)–#africanamerican–Change Lending, LLC (“Change”) announced today that the Federal Home Loan Bank of San Francisco (“FHLB-SF” or the “Bank”) has approved Change’s application for membership in the Bank. This decision was based on the determination that Change satisfied all statutory requirements for membership – including those relating to capital, profitability, and liquidity. Change’s membership will become effective upon Change’s acquisition of capital stock in the FHLB-SF. Change Lending and its parent company, The Change Company CDFI LLC (“The Change Company”), are each community development financial institutions certified by the United States Department of the Treasury. Change focuses on making home loans to underserved, prime homeowners. Since becoming a CDFI in 2018, Change Lending’s loans have been primarily to Black, Latino, and low-income borrowers, and borrowers who reside in low-income communities. Steven Sugarman, Founder of The Change Company, stated, “Change Lending is proud to become a member of the FHLB-SF. We welcome a partnership with the FHLB-SF to enhance our strength and reach as America’s CDFI. We are excited to expand our impact and better serve our target market borrowers.” Change has been recognized as America’s largest Non-QM lender and is the first non-bank CDFI to earn a AAA-rating on its residential mortgage loan securitizations. The United States Department of the Treasury’s Community Development Financial Institutions Fund (the “Treasury”) most recently renewed Change’s CDFI Certification in February 2024. The renewal followed the completion of Treasury’s review of Change’s CDFI Annual Certification Report. Reverend Everett Bell, Jr., Chair of Change’s Community Advisory Board, stated, “We are pleased with the decision of the FHFA and FHLB-SF to approve Change’s application for membership in the FHLB-SF. We look forward to working in partnership with the FHLB-SF to bring greater equity to homeownership.” Learn more about Change at www.TheChangeCompany.com. Contacts Lindsay Valdeon Lindsay.Valdeon@TheChangeCompany.com",https://www.fintechfutures.com/wp-content/themes/fintech_child/assets/images/fallback/default-image-110x110.jpg,2024-03-13,0.69,"[{'type': 'ORG', 'name': 'Calif', 'description': 'business', 'full_name': ""Société Anonyme de Credit a l'Industrie Francaise""}, {'type': 'LOC', 'name': 'ANAHEIM', 'latitude': 33.835289001464844, 'longitude': -117.91449737548828, 'location_type': 'CITY'}, {'type': 'LOC', 'name': 'LLC', 'latitude': 52.92100143432617, 'longitude': -4.057000160217285, 'location_type': 'POI'}, {'type': 'LOC', 'name': 'Bank', 'latitude': 50.82939910888672, 'longitude': 6.0697197914123535, 'location_type': 'CITY'}, {'type': 'LOC', 'name': 'San Francisco', 'latitude': 37.77492904663086, 'longitude': -122.41941833496094, 'location_type': 'CITY'}, {'type': 'LOC', 'name': 'Change', 'latitude': 32.14590072631836, 'longitude': 74.52554321289062, 'location_type': 'CITY'}, {'type': 'LOC', 'name': 'Black', 'latitude': 38.467830657958984, 'longitude': -88.10282135009766, 'location_type': 'CITY'}, {'type': 'LOC', 'name': 'America', 'latitude': 39.7599983215332, 'longitude': -98.5, 'location_type': 'COUNTRY'}]","Change Lending, a CDFI, has been approved for membership in the Federal Home Loan Bank of San Francisco (FHLB-SF). This membership will enhance Change's strength and reach as a CDFI, allowing it to better serve its target market borrowers."
